### ISSUE TITLE
Sish responds with "kex_exchange_identification: Connection closed by remote host"

### ISSUE THREAD

**Issue by carlfriedrich** [antoniomika/sish#346]
I have a Sish server running and several devices connecting to it successfully.

One device, however, does not connect for some reason. This is my commandline on the client:

```
ssh -R bar:443:localhost:443 sish.foo.de tcp-alias=true auto-close=false
```

Which results in the following message:

```
ex_exchange_identification: Connection closed by remote host
Connection closed by <ip> port 22
```

I have no idea, yet, how the device differs from the other ones being able to successfully connect.

Running `tshark` on the Sish server I can see that the packages arrive on the server. In the Sish log, I don't see any connection attempts, though.

@antoniomika Did you see this message before? Do you have an idea why the connection is closed?

**Comment by antoniomika** [comment]
Hey @carlfriedrich,

Can you run the ssh command above with "-vvv" to get the debug output? That'll give us more info from the client since it seems a bit suspect that the sish process doesn't output anything about even the TCP connection.

Thanks!

**Comment by carlfriedrich** [comment]
@antoniomika Thanks for the quick reply!

Sure:

```
debug1: Reading configuration data /etc/ssh/ssh_config
debug1: /etc/ssh/ssh_config line 19: include /etc/ssh/ssh_config.d/*.conf matched no files
debug1: /etc/ssh/ssh_config line 21: Applying options for *
debug3: expanded UserKnownHostsFile '~/.ssh/known_hosts' -> '/root/.ssh/known_hosts'
debug3: expanded UserKnownHostsFile '~/.ssh/known_hosts2' -> '/root/.ssh/known_hosts2'
debug2: resolving "sish.foo.de" port 22
debug2: ssh_connect_direct
debug1: Connecting to sish.foo.de [<ip>] port 22.
debug1: Connection established.
debug1: identity file /root/.ssh/id_rsa type -1
debug1: identity file /root/.ssh/id_rsa-cert type -1
debug1: identity file /root/.ssh/id_dsa type -1
debug1: identity file /root/.ssh/id_dsa-cert type -1
debug1: identity file /root/.ssh/id_ecdsa type -1
debug1: identity file /root/.ssh/id_ecdsa-cert type -1
debug1: identity file /root/.ssh/id_ecdsa_sk type -1
debug1: identity file /root/.ssh/id_ecdsa_sk-cert type -1
debug1: identity file /root/.ssh/id_ed25519 type -1
debug1: identity file /root/.ssh/id_ed25519-cert type -1
debug1: identity file /root/.ssh/id_ed25519_sk type -1
debug1: identity file /root/.ssh/id_ed25519_sk-cert type -1
debug1: identity file /root/.ssh/id_xmss type -1
debug1: identity file /root/.ssh/id_xmss-cert type -1
debug1: Local version string SSH-2.0-OpenSSH_8.4p1 Debian-5+deb11u3
kex_exchange_identification: Connection closed by remote host
Connection closed by <ip> port 22
```

(Hostname and IP have been replaced and do not resemble the real values)

**Comment by antoniomika** [comment]
Are the host name and ip at least consistent with what's expected? 

Also, is port 22 correct as well? This just makes it seem like it just never received a response from sish (like a firewall was in the way or port was wrong).

**Comment by carlfriedrich** [comment]
Thanks for checking. Yes, hostname and IP are what's expected, so DNS resolution works.

Port 22 is correct, we have the "normal" SSH server running on port 8022 and Sish on 22.

The same command works from several devices, but not for this one.

And as I wrote: I see the incoming packages with `tshark` on the server, so I assume that firewall should not be an issue.

**Comment by antoniomika** [comment]
Can you share the full trace from tshark?

Are you running sish in docker or as a binary on the host?

Also, can you run "telnet <ip> 22" and share that as well? That'll tell us if the server version header is at least being sent.

**Comment by carlfriedrich** [comment]
I am running sish in docker.

telnet does indeed not receive the server version header when run from the specific device:

```
Trying <ip>...
Connected to <host>.
Escape character is '^]'.
Connection closed by foreign host.
```

When tested from a different device:

```
Trying <ip>....
Connected to <host>.
Escape character is '^]'.
SSH-2.0-sish
Connection closed by foreign host.
```

tshark log for failing device:

```
  232 30.859853485 <non-working-ip> → <sish-ip> TCP 74 33382 → 22 [SYN] Seq=0 Win=42340 Len=0 MSS=1409 SACK_PERM TSval=1630491956 TSecr=0 WS=256
  233 30.859931242 <sish-ip> → <non-working-ip> TCP 74 22 → 33382 [SYN, ACK] Seq=0 Ack=1 Win=65160 Len=0 MSS=1460 SACK_PERM TSval=2748899145 TSecr=1630491956 WS=64
  234 30.944250668 <non-working-ip> → <sish-ip> TCP 66 33382 → 22 [ACK] Seq=1 Ack=1 Win=42496 Len=0 TSval=1630492022 TSecr=2748899145
  235 30.944763473 <sish-ip> → <non-working-ip> TCP 66 22 → 33382 [FIN, ACK] Seq=1 Ack=1 Win=65216 Len=0 TSval=2748899230 TSecr=1630492022
  236 31.000928015 <non-working-ip> → <sish-ip> TCP 66 [TCP Previous segment not captured] 33382 → 22 [FIN, ACK] Seq=41 Ack=2 Win=42496 Len=0 TSval=1630492111 TSecr=2748899230
  237 31.000974999 <sish-ip> → <non-working-ip> TCP 54 22 → 33382 [RST] Seq=2 Win=0 Len=0
  238 31.163566327 <non-working-ip> → <sish-ip> TCP 106 [TCP Retransmission] 33382 → 22 [PSH, ACK] Seq=1 Ack=1 Win=42496 Len=40 TSval=1630492024 TSecr=2748899145
  239 31.163605958 <sish-ip> → <non-working-ip> TCP 54 22 → 33382 [RST] Seq=1 Win=0 Len=0
```

tshark log for working device:

```
  176 3.893576110 <working-ip> → <sish-ip> TCP 74 35350 → 22 [SYN] Seq=0 Win=64240 Len=0 MSS=1460 SACK_PERM TSval=2424377738 TSecr=0 WS=128
  177 3.893682744 <sish-ip> → <working-ip> TCP 74 22 → 35350 [SYN, ACK] Seq=0 Ack=1 Win=65160 Len=0 MSS=1460 SACK_PERM TSval=2432721222 TSecr=2424377738 WS=64
  178 3.893898867 <working-ip> → <sish-ip> TCP 66 35350 → 22 [ACK] Seq=1 Ack=1 Win=64256 Len=0 TSval=2424377739 TSecr=2432721222
  179 3.894464496 <working-ip> → <sish-ip> SSH 108 Client: Protocol (SSH-2.0-OpenSSH_8.2p1 Ubuntu-4ubuntu0.13)
  180 3.894484226 <sish-ip> → <working-ip> TCP 66 22 → 35350 [ACK] Seq=1 Ack=43 Win=65152 Len=0 TSval=2432721223 TSecr=2424377739
  181 3.901056433 <sish-ip> → <working-ip> SSHv2 80 Server: Protocol (SSH-2.0-sish)
  182 3.901253021 <working-ip> → <sish-ip> TCP 66 35350 → 22 [ACK] Seq=43 Ack=15 Win=64256 Len=0 TSval=2424377746 TSecr=2432721230
  183 3.902217320 <working-ip> → <sish-ip> SSHv2 1602 Client: Key Exchange Init
  184 3.906943461 <working-ip> → <sish-ip> TCP 154 [TCP Retransmission] 35350 → 22 [PSH, ACK] Seq=1491 Ack=15 Win=64256 Len=88 TSval=2424377752 TSecr=2432721230
  185 3.906960353 <sish-ip> → <working-ip> TCP 78 22 → 35350 [ACK] Seq=15 Ack=1579 Win=63616 Len=0 TSval=2432721235 TSecr=2424377747 SLE=1491 SRE=1579
  186 3.907047049 <sish-ip> → <working-ip> SSHv2 786 Server: Key Exchange Init
  187 3.907144354 <working-ip> → <sish-ip> TCP 66 35350 → 22 [ACK] Seq=1579 Ack=735 Win=64128 Len=0 TSval=2424377752 TSecr=2432721236
  188 3.909392849 <working-ip> → <sish-ip> SSHv2 114 Client: Elliptic Curve Diffie-Hellman Key Exchange Init
  189 3.910983852 <sish-ip> → <working-ip> SSHv2 258 Server: Elliptic Curve Diffie-Hellman Key Exchange Reply
  190 3.911043146 <sish-ip> → <working-ip> SSHv2 82 Server: New Keys
  191 3.911081394 <sish-ip> → <working-ip> SSHv2 326 Server: 
  192 3.911180931 <working-ip> → <sish-ip> TCP 66 35350 → 22 [ACK] Seq=1627 Ack=927 Win=64128 Len=0 TSval=2424377756 TSecr=2432721239
  193 3.911181091 <working-ip> → <sish-ip> TCP 66 35350 → 22 [ACK] Seq=1627 Ack=943 Win=64128 Len=0 TSval=2424377756 TSecr=2432721240
  194 3.911181138 <working-ip> → <sish-ip> TCP 66 35350 → 22 [ACK] Seq=1627 Ack=1203 Win=63872 Len=0 TSval=2424377756 TSecr=2432721240
  195 3.920755778 <working-ip> → <sish-ip> SSHv2 82 Client: New Keys
  196 3.961118095 <sish-ip> → <working-ip> TCP 66 22 → 35350 [ACK] Seq=1203 Ack=1643 Win=63616 Len=0 TSval=2432721290 TSecr=2424377765
  197 3.961319461 <working-ip> → <sish-ip> SSHv2 110 Client: 
  198 3.961346198 <sish-ip> → <working-ip> TCP 66 22 → 35350 [ACK] Seq=1203 Ack=1687 Win=63616 Len=0 TSval=2432721290 TSecr=2424377806
  199 3.961459754 <sish-ip> → <working-ip> SSHv2 110 Server: 
  200 3.961577986 <working-ip> → <sish-ip> TCP 66 35350 → 22 [ACK] Seq=1687 Ack=1247 Win=64128 Len=0 TSval=2424377806 TSecr=2432721290
  201 3.961617963 <working-ip> → <sish-ip> SSHv2 126 Client: 
  202 3.962172377 <sish-ip> → <working-ip> SSHv2 110 Server: 
  203 3.962263807 <working-ip> → <sish-ip> TCP 66 35350 → 22 [ACK] Seq=1747 Ack=1291 Win=64128 Len=0 TSval=2424377807 TSecr=2432721291
  204 3.962372601 <working-ip> → <sish-ip> SSHv2 206 Client: 
  205 3.962861241 <sish-ip> → <working-ip> SSHv2 110 Server: 
  206 3.962952488 <working-ip> → <sish-ip> TCP 66 35350 → 22 [ACK] Seq=1887 Ack=1335 Win=64128 Len=0 TSval=2424377808 TSecr=2432721291
  207 3.963417898 <working-ip> → <sish-ip> TCP 66 35350 → 22 [FIN, ACK] Seq=1887 Ack=1335 Win=64128 Len=0 TSval=2424377808 TSecr=2432721291
  208 3.963471277 <sish-ip> → <working-ip> TCP 66 22 → 35350 [FIN, ACK] Seq=1335 Ack=1888 Win=63488 Len=0 TSval=2432721292 TSecr=2424377808
  209 3.963576987 <working-ip> → <sish-ip> TCP 66 35350 → 22 [ACK] Seq=1888 Ack=1336 Win=64128 Len=0 TSval=2424377808 TSecr=2432721292
```

**Comment by antoniomika** [comment]
Hrm yeah that makes it seem like there's some environmental issue with your setup, nothing from sish.

The only thing that *could* be from sish is the ip filtering stuff. Are you utilizing that? If not, then you should check firewalls on both sides. Also, is fail2ban running on the sish server or anything?

**Comment by carlfriedrich** [comment]
And furthermore: When I run the normal openSSH server on port 22, I can connect from both devices. Running sish on 8022 shows the same problem, though.

**Comment by antoniomika** [comment]
Hrm in that case maybe it's a docker networking issue? What happens when you access the sish HTTP ports? 

You can try running a simple echo server in docker and check it that way?

**Comment by carlfriedrich** [comment]
Oh wow, that was the hint to the right direction!

Connecting to the sish http port 80 or https port 443 both reported `403 Forbidden` on the failing device, while it correctly received the sish GitHub page when accessed from the working device.

This made me double-check my sish config and I noticed I hat `whitelisted-countries=de` set! Removing this resolves the issue.

Thanks a lot for your help on this @antoniomika !
